{
  "normalized_term": "kumari",
  "term": "kumārī",
  "entry_type": "minor",
  "part_of_speech": "noun",
  "literal_meaning": "girl, maiden",
  "preferred_translation": "girl",
  "definition": "A girl or young unmarried woman.",
  "notes": "Use clear contemporary English in narrative and social contexts. Keep role and status plain rather than importing later devotional or academic jargon.",
  "tags": [
    "persons"
  ],
  "status": "reviewed",
  "alternative_translations": [
    "maiden"
  ]
}
