{
  "normalized_term": "visakha",
  "term": "Visākhā",
  "entry_type": "minor",
  "part_of_speech": "noun",
  "literal_meaning": "proper name",
  "preferred_translation": "Visākhā",
  "definition": "Visākhā in narrative and donor contexts.",
  "notes": "Use clear contemporary English in narrative and social contexts. Keep role and status plain rather than importing later devotional or academic jargon.",
  "tags": [
    "persons"
  ],
  "status": "reviewed"
}
