{
  "term": "hatavikkhittaka",
  "normalized_term": "hatavikkhittaka",
  "entry_type": "minor",
  "part_of_speech": "noun",
  "preferred_translation": "mutilated and scattered corpse",
  "definition": "An unattractive body image used to cool lust and attachment.",
  "status": "reviewed",
  "literal_meaning": "mutilated and scattered corpse",
  "tags": [
    "meditative-development",
    "embodiment"
  ]
}
