{
  "term": "jarāmaraṇa",
  "normalized_term": "jaramarana",
  "entry_type": "major",
  "part_of_speech": "compound",
  "literal_meaning": "old age and death",
  "preferred_translation": "ageing and dying",
  "alternative_translations": [
    "aging-and-death",
    "old age and death"
  ],
  "discouraged_translations": [
    "mortality"
  ],
  "untranslated_preferred": false,
  "definition": "Ageing and dying as the culminating suffering conditioned by rebirth in the dependent-arising sequence.",
  "notes": "This entry uses ageing and dying as the house default because it reads naturally in English while preserving the compound movement of the term. Old age and death remains the literal anchor, and aging-and-death remains available where the tighter doctrinal compound is preferred. The term should be heard as the culminating afflicted outcome of the chain, along with the standard expansion into sorrow and related forms of distress.",
  "context_rules": [
    {
      "context": "In most dependent-arising contexts",
      "rendering": "ageing and dying",
      "notes": "Default project rendering."
    },
    {
      "context": "In more literal or tightly formulaic doctrinal prose",
      "rendering": "aging-and-death",
      "notes": "Acceptable alternate when the compound structure should remain more explicit."
    },
    {
      "context": "In explanatory prose where a familiar phrase helps",
      "rendering": "old age and death",
      "notes": "Acceptable alternate outside tightly patterned formula translation."
    },
    {
      "context": "When the passage emphasizes the culminating suffering that follows rebirth in the sequence",
      "rendering": "ageing and dying",
      "notes": "Keep the place of the link as the terminal compound explicit."
    }
  ],
  "related_terms": [
    "bhava",
    "dukkha",
    "jāti",
    "parideva",
    "paṭiccasamuppāda",
    "saṃsāra",
    "soka",
    "upayasa",
    "upāyāsa"
  ],
  "example_phrases": [
    {
      "pali": "jātipaccayā jarāmaraṇaṃ",
      "translation": "with rebirth as condition, ageing and dying",
      "notes": "Closing link of the standard sequence.",
      "source": "SN 12.2"
    },
    {
      "pali": "sokaparidevadukkhadomanassupāyāsā sambhavanti",
      "translation": "sorrow, lamentation, dissatisfaction, distress, and despair come to be",
      "notes": "Standard expansion following ageing and dying in the formula.",
      "source": "SN 12.2"
    }
  ],
  "sutta_references": [
    "SN 12.2",
    "SN 56.11"
  ],
  "tags": [
    "core-doctrine",
    "dependent-origination",
    "four-noble-truths"
  ],
  "status": "stable",
  "authority_basis": [
    {
      "source": "Repository editorial record",
      "priority": "osf-house",
      "kind": "rationale",
      "scope": "Current house policy is preserved from the existing rule-bearing entry; source-specific provenance still needs refinement."
    }
  ],
  "translation_policy": {
    "default_scope": "Use 'ageing and dying' as the default rendering in the entry's governed translation contexts unless a recorded context rule overrides it.",
    "when_not_to_apply": "Yield to recorded context_rules, source-facing technical use, or other explicitly documented local reasons rather than rotating among alternates ad hoc.",
    "compound_inheritance": "inherit",
    "drift_risk": "Prevents drift back toward 'mortality' or other unrecorded alternates."
  }
}
