{
  "normalized_term": "putta",
  "term": "putta",
  "entry_type": "minor",
  "part_of_speech": "noun",
  "literal_meaning": "son, child",
  "preferred_translation": "son",
  "definition": "A son or child depending on context.",
  "notes": "Use clear contemporary English in narrative and social contexts. Keep role and status plain rather than importing later devotional or academic jargon.",
  "tags": [
    "persons"
  ],
  "status": "reviewed"
}
