{
  "term": "hadaya",
  "normalized_term": "hadaya",
  "entry_type": "minor",
  "part_of_speech": "noun",
  "preferred_translation": "heart",
  "definition": "The physical heart, listed as one of the body parts in contemplation of the body; distinct from the psychological heart used to render citta.",
  "status": "reviewed",
  "literal_meaning": "physical heart",
  "tags": [
    "embodiment",
    "meditative-development"
  ]
}
