{
  "term": "samudaya-ariyasacca",
  "normalized_term": "samudaya-ariyasacca",
  "entry_type": "minor",
  "part_of_speech": "compound",
  "preferred_translation": "noble truth of arising",
  "definition": "The second noble truth, concerning the arising of dissatisfaction through craving.",
  "status": "reviewed",
  "literal_meaning": "noble truth of arising",
  "tags": [
    "core-doctrine",
    "four-noble-truths"
  ]
}
