{
  "term": "danta",
  "normalized_term": "danta",
  "entry_type": "minor",
  "part_of_speech": "noun",
  "preferred_translation": "teeth",
  "definition": "One of the body parts commonly used in contemplation of the body.",
  "status": "reviewed",
  "literal_meaning": "teeth",
  "tags": [
    "embodiment",
    "meditative-development"
  ]
}
