{
  "normalized_term": "mitta",
  "term": "mitta",
  "entry_type": "minor",
  "part_of_speech": "noun",
  "literal_meaning": "friend",
  "preferred_translation": "friend",
  "definition": "A friend, ally, or companion.",
  "notes": "Use clear contemporary English in narrative and social contexts. Keep role and status plain rather than importing later devotional or academic jargon.",
  "tags": [
    "persons"
  ],
  "status": "reviewed"
}
