{
  "normalized_term": "naya",
  "term": "naya",
  "entry_type": "minor",
  "part_of_speech": "noun",
  "literal_meaning": "method, line of reasoning",
  "preferred_translation": "line of interpretation",
  "definition": "A method, line of reasoning, or interpretive approach.",
  "notes": "Keep the rendering aligned with existing house terms and avoid importing later scholastic system language where the early-text function is simpler.",
  "tags": [
    "core-doctrine"
  ],
  "status": "draft",
  "alternative_translations": [
    "method",
    "approach"
  ]
}
