{
  "term": "ahetuka",
  "normalized_term": "ahetuka",
  "entry_type": "minor",
  "part_of_speech": "noun",
  "preferred_translation": "rootless",
  "definition": "A supporting doctrinal, meditative, or analytical term used across Buddhist teaching.",
  "status": "reviewed",
  "literal_meaning": "rootless",
  "tags": [
    "core-practice"
  ]
}
