{
  "term": "āsavānaṃ khayā",
  "normalized_term": "asavanam-khaya",
  "entry_type": "minor",
  "part_of_speech": "phrase",
  "literal_meaning": "through the wearing away of the outflows",
  "preferred_translation": "through the wearing away of the outflows",
  "alternative_translations": [
    "through the ending of the outflows"
  ],
  "discouraged_translations": [
    "through the destruction of defilements"
  ],
  "definition": "A standard liberation formula naming release through the wearing away of the outflows.",
  "notes": "Use this phrase record when the liberation formula appears as a whole. It should inherit the āsava headword default and keep the outflow-family wording stable rather than drifting into generic defilement-language.",
  "related_terms": [
    "asava",
    "khaya"
  ],
  "example_phrases": [
    {
      "pali": "Jānato ahaṁ, bhikkhave, passato āsavānaṁ khayaṁ vadāmi",
      "translation": "It is for one who knows and sees, bhikkhus, that I speak of the wearing away of the outflows",
      "notes": "Classic liberation formula. Keep the outflow wording stable here. MN 2 contains no `cetovimutti`, so the long stock phrase previously quoted was not in it. Citation repaired 2026-08-21 in the inflected/inconclusive sweep; MN 2 was the right sutta, so the fix quotes what it says.",
      "source": "MN 2"
    }
  ],
  "sutta_references": [
    "MN 2",
    "MN 36"
  ],
  "translation_policy": {
    "default_scope": "Use this as the standard whole-phrase liberation formula when the full asavanam-khaya expression is present.",
    "when_not_to_apply": "Do not recast the phrase into generic defilement or generic ending language, and do not prefer the shorter compound record when the full phrase is the actual text being translated.",
    "compound_inheritance": "blocked",
    "drift_risk": "Prevents the full outflow-ending formula from drifting away from the repository's governed asava and khaya wording."
  },
  "tags": [
    "core-doctrine",
    "formula",
    "liberation",
    "translation-sensitive"
  ],
  "status": "stable"
}
