{
  "normalized_term": "vessa",
  "term": "vessa",
  "entry_type": "minor",
  "part_of_speech": "noun",
  "literal_meaning": "merchant commoner",
  "preferred_translation": "merchant-householder",
  "definition": "A member of the productive or mercantile social class.",
  "notes": "Use clear contemporary English in narrative and social contexts. Keep role and status plain rather than importing later devotional or academic jargon.",
  "tags": [
    "persons"
  ],
  "status": "reviewed",
  "alternative_translations": [
    "merchant"
  ],
  "discouraged_translations": [
    "caste"
  ]
}
